{
  "schema_version": "1.0",
  "work_item": "REQUEST-jordan-0072",
  "stage": "impl",
  "review_type": "code",
  "reviewer": {
    "subagent_id": "af109e7",
    "model": "claude-sonnet-4-20250514"
  },
  "timestamp": "2026-01-20T14:55:00Z",
  "findings": [
    {
      "id": "F001",
      "severity": "medium",
      "category": "quality",
      "file": "tools/gh",
      "line_start": 28,
      "line_end": 31,
      "issue": "Conditional source without fallback logging - log_start/log_end undefined if _log-helper missing",
      "recommendation": "Define no-op functions when _log-helper is missing, or make the source mandatory with a clear error message"
    },
    {
      "id": "F002",
      "severity": "medium",
      "category": "quality",
      "file": "tools/gh",
      "line_start": 96,
      "line_end": 96,
      "issue": "Token extraction error handling masks failures - 2>/dev/null masks all errors",
      "recommendation": "Capture stderr from the secret command and include it in the warning message"
    },
    {
      "id": "F003",
      "severity": "medium",
      "category": "quality",
      "file": "tools/gh",
      "line_start": 131,
      "line_end": 131,
      "issue": "Temp files trap uses single quotes - cleanup could fail if paths contain special characters",
      "recommendation": "Use double quotes in the trap for variable expansion"
    },
    {
      "id": "F004",
      "severity": "low",
      "category": "quality",
      "file": "tools/gh",
      "line_start": 147,
      "line_end": 147,
      "issue": "Literal \\n in variable assignment creates backslash-n, not newline",
      "recommendation": "Use $'\\n' syntax for actual newlines",
      "code_snippet": "NEWLINE=\"\\n\""
    },
    {
      "id": "F005",
      "severity": "medium",
      "category": "quality",
      "file": "tools/gh",
      "line_start": 96,
      "line_end": 96,
      "issue": "Secret name hardcoded as github-admin-token",
      "recommendation": "Support GH_SECRET_NAME environment variable for custom secret names"
    }
  ]
}
